STNAME,FIPS,CTYNAME,TOT_POP,TOT_MALE,TOT_FEMALE,WA_MALE,WA_FEMALE,NHWA_MALE,NHWA_FEMALE,NHWhite_Alone,Not_NHWhite_Alone,MinorityMinority,MinorityPCT,Black,BlackPCT,Hispanic,HispanicPCT
Iowa,1890801,Adair CountyAdams CountyAllamakee CountyAppanoose CountyAudubon CountyBenton CountyBlack Hawk CountyBoone CountyBremer CountyBuchanan CountyBuena Vista CountyButler CountyCalhoun CountyCarroll CountyCass CountyCedar CountyCerro Gordo CountyCherokee CountyChickasaw CountyClarke CountyClay CountyClayton CountyClinton CountyCrawford CountyDallas CountyDavis CountyDecatur CountyDelaware CountyDes Moines CountyDickinson CountyDubuque CountyEmmet CountyFayette CountyFloyd CountyFranklin CountyFremont CountyGreene CountyGrundy CountyGuthrie CountyHamilton CountyHancock CountyHardin CountyHarrison CountyHenry CountyHoward CountyHumboldt CountyIowa CountyJackson CountyJasper CountyJefferson CountyJohnson CountyJones CountyKeokuk CountyKossuth CountyLinn CountyLouisa CountyLucas CountyLyon CountyMadison CountyMahaska CountyMarion CountyMarshall CountyMills CountyMitchell CountyMonona CountyMonroe CountyMontgomery CountyMuscatine CountyO'Brien CountyOsceola CountyPage CountyPalo Alto CountyPlymouth CountyPocahontas CountyPolk CountyPottawattamie CountyPoweshiek CountyRinggold CountyScott CountyShelby CountySioux CountyStory CountyTama CountyTaylor CountyUnion CountyVan Buren CountyWapello CountyWarren CountyWashington CountyWayne CountyWebster CountyWinnebago CountyWinneshiek CountyWoodbury CountyWorth CountyWright CountyIda CountyLee CountySac County,3074186,1524488,1549698,1410102,1441431,1333026,1372568,2705594,368592,NoNoNoNoNoNoNoNoNoNoNoNoNoNoNoNoNoNoNoNoNoNoNoNoNoNoNoNoNoNoNoNoNoNoNoNoNoNoNoNoNoNoNoNoNoNoNoNoNoNoNoNoNoNoNoNoNoNoNoNoNoNoNoNoNoNoNoNoNoNoNoNoNoNoNoNoNoNoNoNoNoNoNoNoNoNoNoNoNoNoNoNoNoNoNoNoNoNoNo,2.45%2.86%8.27%3.69%2.37%2.96%16.39%4.59%3.81%3.16%34.88%2.56%4.59%3.89%4.02%3.81%7.68%5.18%3.67%12.90%5.28%3.39%7.87%29.81%12.08%2.58%6.74%2.27%11.10%2.95%7.32%11.86%4.96%5.64%12.77%4.42%4.46%2.43%3.69%9.01%5.54%6.48%3.00%11.16%2.79%5.65%3.64%3.79%4.53%14.42%17.64%4.98%2.78%3.28%11.33%19.81%2.27%3.34%3.17%5.28%4.87%23.91%4.92%2.31%4.29%4.42%4.91%20.42%5.97%7.70%7.85%4.03%5.35%4.99%19.91%10.59%6.63%3.63%17.69%3.69%11.19%13.55%16.41%8.57%4.53%2.64%13.45%4.39%7.77%3.23%10.55%6.00%4.58%22.99%3.99%11.40%3.31%8.83%3.71%,97080,0%0%1%1%0%0%9%1%1%0%3%0%2%1%0%0%1%1%0%1%1%0%3%2%2%0%2%0%5%0%3%1%1%1%1%1%1%0%0%1%1%1%0%3%0%1%1%1%1%1%5%2%0%0%4%1%0%0%0%1%1%2%0%0%0%0%0%2%1%0%2%1%0%1%6%1%1%0%7%0%1%3%1%0%1%0%2%1%1%0%4%1%1%3%1%1%0%3%0%,162894,1.26%1.00%6.02%1.57%0.85%1.23%3.93%2.15%1.21%1.34%24.51%1.05%1.56%1.90%2.26%1.73%4.03%2.80%2.44%10.90%2.98%1.83%2.79%26.65%6.24%1.07%2.67%0.99%2.79%1.44%2.07%9.21%2.07%2.16%11.18%2.45%2.57%1.09%1.99%5.26%3.52%3.75%1.37%4.31%1.39%3.79%2.04%1.31%1.53%2.79%5.14%1.38%1.32%1.68%2.89%16.40%1.06%2.29%1.37%1.80%1.75%18.48%2.66%1.24%1.45%2.39%3.14%16.48%3.91%6.06%2.99%1.98%3.30%3.08%7.86%6.83%2.59%1.82%5.97%2.10%9.24%3.14%7.86%7.10%2.17%1.18%9.50%2.05%5.37%1.37%4.11%3.33%2.02%14.19%2.27%9.45%1.81%3.29%2.29%
Kansas,2111025,Allen CountyAnderson CountyAtchison CountyBarber CountyBarton CountyBourbon CountyBrown CountyButler CountyChase CountyChautauqua CountyCherokee CountyCheyenne CountyClark CountyClay CountyCloud CountyCoffey CountyComanche CountyCowley CountyCrawford CountyDecatur CountyDickinson CountyDoniphan CountyDouglas CountyEdwards CountyElk CountyEllis CountyEllsworth CountyFinney CountyFord CountyFranklin CountyGeary CountyGove CountyGraham CountyGrant CountyGray CountyGreeley CountyGreenwood CountyHamilton CountyHarper CountyHarvey CountyHaskell CountyHodgeman CountyJackson CountyJefferson CountyJewell CountyJohnson CountyKearny CountyKingman CountyKiowa CountyLabette CountyLane CountyLeavenworth CountyLincoln CountyLinn CountyLogan CountyLyon CountyMcPherson CountyMarion CountyMarshall CountyMeade CountyMiami CountyMitchell CountyMontgomery CountyMorris CountyMorton CountyNemaha CountyNeosho CountyNess CountyNorton CountyOsage CountyOsborne CountyOttawa CountyPawnee CountyPhillips CountyPottawatomie CountyPratt CountyRawlins CountyReno CountyRepublic CountyRice CountyRiley CountyRooks CountyRush CountyRussell CountySaline CountyScott CountySedgwick CountySeward CountyShawnee CountySheridan CountySherman CountySmith CountyStafford CountyStanton CountyStevens CountySumner CountyThomas CountyTrego CountyWabaunsee CountyWallace CountyWashington CountyWichita CountyWilson CountyWoodson CountyWyandotte County,2885905,1435281,1450624,1250761,1266902,1103151,1132285,2235436,650469,NoNoNoNoNoNoNoNoNoNoNoNoNoNoNoNoNoNoNoNoNoNoNoNoNoNoNoYesYesNoNoNoNoNoNoNoNoNoNoNoNoNoNoNoNoNoNoNoNoNoNoNoNoNoNoNoNoNoNoNoNoNoNoNoNoNoNoNoNoNoNoNoNoNoNoNoNoNoNoNoNoNoNoNoNoNoNoYesNoNoNoNoNoNoNoNoNoNoNoNoNoNoNoNoYes,8.64%4.99%11.02%5.62%17.06%8.56%16.13%9.37%7.29%12.01%11.05%7.36%13.02%4.99%5.81%5.49%6.80%18.68%11.79%4.18%8.05%9.23%19.14%21.48%7.83%9.05%13.21%55.09%57.75%8.30%40.11%3.55%9.97%46.95%16.48%16.49%7.39%34.22%9.12%15.74%30.55%8.81%14.94%5.63%4.27%18.75%32.48%5.49%8.29%14.95%7.81%20.27%4.66%5.19%7.29%27.64%7.41%5.77%4.22%18.99%6.88%3.70%19.40%6.88%25.31%4.07%8.95%10.53%9.44%5.33%3.23%4.91%14.67%5.11%9.62%10.24%5.70%14.43%2.86%14.69%21.62%4.10%5.34%5.69%18.63%18.35%30.50%65.74%24.73%4.49%15.05%4.12%15.99%39.45%34.92%9.14%8.00%3.92%6.22%9.10%4.93%28.72%6.62%5.92%57.12%,178820,2%1%5%1%2%3%1%2%1%1%1%0%1%1%1%1%0%3%2%1%1%3%4%2%0%1%5%3%3%1%18%0%4%1%1%0%0%0%1%2%1%1%1%1%0%5%1%0%1%5%1%10%0%1%1%3%1%1%0%1%1%0%6%1%1%1%1%1%3%0%0%1%5%1%1%1%1%3%1%1%7%1%0%1%3%0%10%4%9%0%1%0%1%1%1%1%1%1%1%1%1%1%0%0%25%,317061,2.99%1.68%2.55%2.69%13.79%2.21%3.48%4.09%3.63%2.83%2.13%5.71%8.39%2.46%3.11%2.22%4.60%9.79%4.95%1.92%4.39%2.39%5.46%19.17%3.27%5.15%5.76%47.74%52.14%3.78%13.80%1.98%2.52%45.00%14.56%14.71%3.78%31.68%6.16%10.96%28.27%5.96%3.79%2.21%2.13%7.38%29.11%2.72%4.81%4.23%4.81%6.40%2.46%2.13%3.84%20.43%3.71%2.67%1.95%15.76%2.90%1.95%5.66%4.01%20.29%1.51%4.50%8.77%4.29%2.35%1.39%2.22%7.19%2.50%4.91%6.30%3.91%8.52%1.32%10.56%7.43%2.01%3.20%2.19%10.28%16.47%13.41%57.91%11.31%3.15%11.76%1.62%13.31%36.78%32.52%4.95%5.00%1.88%3.15%7.51%2.90%26.91%2.75%2.47%26.90%
Kentucky,2534400,Adair CountyAllen CountyAnderson CountyBallard CountyBarren CountyBath CountyBell CountyBoone CountyBourbon CountyBoyd CountyBoyle CountyBracken CountyBreathitt CountyBreckinridge CountyBullitt CountyButler CountyCaldwell CountyCalloway CountyCampbell CountyCarlisle CountyCarroll CountyCarter CountyCasey CountyChristian CountyClark CountyClay CountyClinton CountyCrittenden CountyCumberland CountyDaviess CountyEdmonson CountyElliott CountyEstill CountyFayette CountyFleming CountyFloyd CountyFranklin CountyFulton CountyGallatin CountyGarrard CountyGrant CountyGraves CountyGrayson CountyGreen CountyGreenup CountyHancock CountyHardin CountyHarlan CountyHarrison CountyHart CountyHenderson CountyHenry CountyHickman CountyHopkins CountyJackson CountyJefferson CountyJessamine CountyJohnson CountyKenton CountyKnott CountyKnox CountyLarue CountyLaurel CountyLawrence CountyLee CountyLeslie CountyLetcher CountyLewis CountyLincoln CountyLivingston CountyLogan CountyLyon CountyMcCracken CountyMcCreary CountyMcLean CountyMadison CountyMagoffin CountyMarion CountyMarshall CountyMartin CountyMason CountyMeade CountyMenifee CountyMercer CountyMetcalfe CountyMonroe CountyMontgomery CountyMorgan CountyMuhlenberg CountyNelson CountyNicholas CountyOhio CountyOldham CountyOwen CountyOwsley CountyPendleton CountyPerry CountyPike CountyPowell CountyPulaski CountyRobertson CountyRockcastle CountyRowan CountyRussell CountyScott CountyShelby CountySimpson CountySpencer CountyTaylor CountyTodd CountyTrigg CountyTrimble CountyUnion CountyWarren CountyWashington CountyWayne CountyWebster CountyWhitley CountyWolfe CountyWoodford County,4380415,2157711,2222704,1911706,1971281,1843977,1917025,3761002,619413,NoNoNoNoNoNoNoNoNoNoNoNoNoNoNoNoNoNoNoNoNoNoNoNoNoNoNoNoNoNoNoNoNoNoNoNoNoNoNoNoNoNoNoNoNoNoNoNoNoNoNoNoNoNoNoNoNoNoNoNoNoNoNoNoNoNoNoNoNoNoNoNoNoNoNoNoNoNoNoNoNoNoNoNoNoNoNoNoNoNoNoNoNoNoNoNoNoNoNoNoNoNoNoNoNoNoNoNoNoNoNoNoNoNoNoNoNoNoNoNo,6.03%4.08%5.39%6.22%8.75%4.20%5.33%10.67%14.98%6.26%13.14%3.01%2.46%5.13%4.29%5.00%8.43%9.72%6.72%4.83%10.96%3.14%4.54%32.37%9.42%7.27%4.59%2.98%5.35%10.18%3.99%4.88%2.07%27.33%3.64%2.36%17.59%29.04%8.07%5.76%4.97%12.72%3.60%5.29%3.62%3.68%23.11%4.53%5.70%7.88%12.20%8.19%12.73%10.95%1.82%29.99%8.88%2.23%10.58%2.36%3.57%8.06%3.91%2.04%4.49%1.65%1.94%1.91%5.50%3.18%11.34%8.09%16.16%10.06%2.89%9.77%2.09%13.07%2.81%11.18%10.56%10.80%4.32%8.24%4.09%6.26%6.83%6.43%7.10%9.20%3.70%5.84%10.76%4.58%2.39%2.66%4.05%2.60%3.03%5.22%2.65%2.27%4.98%5.50%12.27%18.95%14.25%5.16%9.18%13.79%11.79%5.27%16.06%18.93%11.66%6.06%10.90%3.56%1.87%13.95%,354119,3%1%2%3%4%1%2%3%6%3%7%1%0%2%1%1%5%4%3%1%2%1%1%21%5%4%0%1%3%5%2%3%0%15%1%1%11%25%1%2%1%5%1%2%1%1%13%2%2%5%8%3%10%7%0%21%3%0%5%1%1%3%1%0%2%0%0%0%2%0%7%5%11%6%1%5%0%8%0%7%7%4%2%4%2%2%3%4%5%5%1%1%4%1%1%1%2%1%1%1%0%0%2%1%6%8%10%2%5%8%8%1%12%9%6%2%4%1%0%5%,142028,1.86%1.59%1.41%1.28%2.76%1.43%0.95%3.71%7.02%1.49%3.06%1.27%0.76%1.19%1.48%3.27%1.29%2.50%1.70%2.03%6.68%1.32%2.69%6.91%2.63%1.87%2.66%0.74%1.03%2.69%1.03%0.78%0.82%6.98%1.23%0.69%2.83%1.26%4.82%2.38%2.43%5.96%1.17%1.62%0.98%1.30%5.31%0.81%1.99%1.51%2.06%3.31%1.18%1.70%0.74%4.62%2.71%0.53%2.86%0.71%1.03%3.10%1.35%0.61%0.87%0.42%0.68%0.70%1.55%1.41%2.56%1.35%2.24%2.32%1.23%2.24%0.92%2.62%1.24%3.15%1.51%3.49%0.88%2.39%1.38%2.81%2.65%0.78%1.28%2.06%1.97%3.67%3.45%2.51%0.89%0.99%0.75%0.71%1.13%2.27%1.10%0.75%1.39%3.43%4.10%9.04%1.83%1.67%1.89%4.03%1.45%3.06%1.83%4.87%3.74%2.95%4.80%0.99%0.70%6.70%
Louisiana,1412096,Acadia ParishAllen ParishAscension ParishAssumption ParishAvoyelles ParishBeauregard ParishBienville ParishBossier ParishCaddo ParishCalcasieu ParishCaldwell ParishCameron ParishCatahoula ParishClaiborne ParishConcordia ParishDe Soto ParishEast Baton Rouge ParishEast Carroll ParishEast Feliciana ParishEvangeline ParishFranklin ParishGrant ParishIberia ParishIberville ParishJackson ParishJefferson ParishJefferson Davis ParishLafayette ParishLafourche ParishLa Salle ParishLincoln ParishLivingston ParishMadison ParishMorehouse ParishNatchitoches ParishOrleans ParishOuachita ParishPlaquemines ParishPointe Coupee ParishRapides ParishRed River ParishRichland ParishSabine ParishSt. Bernard ParishSt. Charles ParishSt. Helena ParishSt. James ParishSt. John the Baptist ParishSt. Landry ParishSt. Martin ParishSt. Mary ParishSt. Tammany ParishTangipahoa ParishTensas ParishTerrebonne ParishUnion ParishVermilion ParishVernon ParishWashington ParishWebster ParishWest Baton Rouge ParishWest Carroll ParishWest Feliciana ParishWinn Parish,4601893,2252050,2349843,1452669,1477468,1356466,1399105,2755571,1846322,NoNoNoNoNoNoNoNoYesNoNoNoNoYesNoNoYesYesNoNoNoNoNoYesNoNoNoNoNoNoNoNoYesNoNoYesNoNoNoNoNoNoNoNoNoYesYesYesNoNoNoNoNoYesNoNoNoNoNoNoNoNoNoNo,21.60%29.25%29.71%33.47%33.82%20.17%45.15%31.14%52.88%30.79%20.97%6.34%34.00%53.46%43.10%42.83%53.73%71.10%47.33%32.03%33.63%22.73%39.68%52.05%32.50%44.88%21.36%32.98%22.42%16.69%46.85%10.66%64.71%49.89%46.34%69.16%40.94%32.69%39.50%38.14%41.87%38.75%31.28%34.01%34.03%55.56%52.27%60.79%44.68%35.04%42.98%19.92%35.79%57.97%31.60%31.98%20.74%29.04%34.13%37.06%41.77%20.26%48.35%34.47%,1491433,18%23%23%30%29%13%42%21%48%25%17%2%32%51%41%38%46%68%45%28%32%16%32%49%29%27%17%26%13%12%41%6%62%48%41%60%37%21%36%32%40%36%17%20%27%53%50%54%42%31%33%12%30%56%19%27%15%15%31%34%38%16%46%31%,208325,1.87%1.50%4.88%2.02%1.59%3.23%1.66%6.19%2.59%2.78%2.39%3.04%0.96%1.37%1.21%2.64%3.83%1.97%1.20%2.32%1.14%4.40%3.35%2.34%1.49%13.11%1.84%4.10%4.08%2.42%2.69%3.16%1.56%1.12%1.91%5.32%2.01%5.48%2.27%2.74%1.35%1.90%3.58%9.69%5.47%1.25%1.43%5.09%1.73%2.34%5.71%5.00%3.66%1.41%4.31%4.34%2.73%8.62%2.00%1.79%2.80%2.73%1.49%1.72%
Maine,368256,Androscoggin CountyAroostook CountyCumberland CountyFranklin CountyHancock CountyKennebec CountyKnox CountyLincoln CountyOxford CountyPenobscot CountyPiscataquis CountySagadahoc CountySomerset CountyWaldo CountyWashington CountyYork County,1329192,650278,678914,619263,647586,611527,639838,1251365,77827,NoNoNoNoNoNoNoNoNoNoNoNoNoNoNoNo,8.23%5.20%8.61%3.59%4.31%4.74%3.83%3.33%3.91%5.55%3.92%5.02%3.72%3.62%9.08%4.74%,17603,4%1%3%0%1%1%1%0%0%1%0%1%0%0%1%1%,18599,1.65%1.02%1.94%1.06%1.33%1.30%1.00%0.92%1.07%1.16%1.07%1.43%0.91%1.02%1.67%1.38%
Maryland,577079,Allegany CountyAnne Arundel CountyBaltimore CountyCalvert CountyCaroline CountyCarroll CountyCecil CountyCharles CountyDorchester CountyFrederick CountyGarrett CountyHarford CountyHoward CountyKent CountyMontgomery CountyPrince George's CountyQueen Anne's CountySt. Mary's CountySomerset CountyTalbot CountyWashington CountyWicomico CountyWorcester CountyBaltimore city,5884563,2850403,3034160,1767442,1811834,1551655,1618633,3170288,2714275,NoNoNoNoNoNoNoYesNoNoNoNoNoNoYesYesNoNoNoNoNoNoNoYes,12.21%28.49%38.63%20.51%22.24%9.23%13.06%53.14%34.41%23.03%3.05%21.59%42.42%21.83%52.15%85.25%12.95%23.98%48.09%21.23%17.84%34.26%19.82%71.82%,1766990,8%16%27%13%14%3%6%42%28%9%1%13%18%15%18%65%7%14%42%13%10%25%14%64%,512010,1.58%6.58%4.57%3.09%5.68%2.79%3.71%4.68%4.04%7.82%0.81%3.83%6.17%4.51%17.94%15.72%3.25%4.26%3.60%5.73%3.77%4.90%3.28%4.44%
Massachusetts,350196,Barnstable CountyBerkshire CountyBristol CountyDukes CountyEssex CountyFranklin CountyHampden CountyHampshire CountyMiddlesex CountyNantucket CountyNorfolk CountyPlymouth CountySuffolk CountyWorcester County,6646144,3220373,3425771,2696886,2863336,2437587,2600336,5037923,1608221,NoNoNoNoNoNoNoNoNoNoNoNoYesNo,7.95%9.80%13.82%10.71%24.92%8.04%33.43%14.24%23.60%20.35%20.50%15.32%52.06%19.73%,525799,2%3%4%4%6%1%11%3%5%7%6%9%25%5%,674073,2.40%3.72%6.42%2.63%17.42%3.51%21.97%4.96%6.97%10.44%3.61%3.39%20.80%9.82%
Michigan,2164889,Alcona CountyAlger CountyAllegan CountyAlpena CountyAntrim CountyArenac CountyBaraga CountyBarry CountyBay CountyBenzie CountyBerrien CountyBranch CountyCalhoun CountyCass CountyCharlevoix CountyCheboygan CountyChippewa CountyClare CountyClinton CountyCrawford CountyDelta CountyDickinson CountyEaton CountyEmmet CountyGenesee CountyGladwin CountyGogebic CountyGrand Traverse CountyGratiot CountyHillsdale CountyHoughton CountyHuron CountyIngham CountyIonia CountyIosco CountyIron CountyIsabella CountyJackson CountyKalamazoo CountyKalkaska CountyKent CountyKeweenaw CountyLake CountyLapeer CountyLeelanau CountyLenawee CountyLivingston CountyLuce CountyMackinac CountyMacomb CountyManistee CountyMarquette CountyMason CountyMecosta CountyMenominee CountyMidland CountyMissaukee CountyMonroe CountyMontcalm CountyMontmorency CountyMuskegon CountyNewaygo CountyOakland CountyOceana CountyOgemaw CountyOntonagon CountyOsceola CountyOscoda CountyOtsego CountyOttawa CountyPresque Isle CountyRoscommon CountySaginaw CountySt. Clair CountySt. Joseph CountySanilac CountySchoolcraft CountyShiawassee CountyTuscola CountyVan Buren CountyWashtenaw CountyWayne CountyWexford County,9883360,4850511,5032849,3910674,4009589,3713171,3820757,7533928,2349432,NoNoNoNoNoNoNoNoNoNoNoNoNoNoNoNoNoNoNoNoNoNoNoNoNoNoNoNoNoNoNoNoNoNoNoNoNoNoNoNoNoNoNoNoNoNoNoNoNoNoNoNoNoNoNoNoNoNoNoNoNoNoNoNoNoNoNoNoNoNoNoNoNoNoNoNoNoNoNoNoNoYesNo,3.23%15.11%10.68%3.76%4.71%4.65%26.47%4.85%9.08%5.43%24.37%8.41%20.44%12.88%5.46%7.51%28.79%4.56%9.47%4.28%6.09%3.86%15.71%8.13%27.45%3.39%9.76%7.10%12.92%4.41%6.73%4.06%27.88%11.48%5.23%4.27%13.13%14.57%20.74%4.53%24.45%2.03%14.45%7.37%8.98%12.64%4.98%20.45%25.16%17.56%10.19%7.18%7.68%8.08%5.94%7.36%4.88%7.76%7.69%3.42%22.73%9.02%25.85%17.00%4.34%3.85%4.74%3.58%4.55%14.83%3.36%3.92%29.73%8.07%12.28%5.71%13.56%5.17%5.95%17.95%28.29%50.21%4.74%,1415107,0%7%1%0%0%0%7%0%2%1%16%2%11%5%0%1%7%1%2%1%0%0%7%1%21%0%4%1%6%1%1%0%12%5%1%0%3%8%11%0%10%0%9%1%0%3%1%11%1%10%3%2%1%3%0%1%0%2%2%0%14%1%14%1%0%0%1%0%0%2%0%1%19%3%3%0%0%1%1%4%13%40%0%,456330,1.30%1.22%6.88%1.23%1.85%1.68%1.24%2.44%4.88%1.96%4.83%4.19%4.63%3.13%1.49%1.11%1.72%1.66%4.22%1.71%0.95%1.20%5.01%1.37%3.15%1.28%1.11%2.46%5.39%1.93%1.34%1.99%7.47%4.71%1.76%1.59%3.52%3.15%4.27%1.44%9.90%0.81%2.38%4.28%3.72%7.63%2.05%1.33%1.47%2.39%2.76%1.31%4.10%1.94%1.37%2.21%2.46%3.24%3.12%1.16%5.05%5.66%3.67%14.17%1.68%1.01%1.67%1.16%1.46%9.03%0.95%1.25%7.94%3.02%6.82%3.65%0.83%2.58%3.04%10.61%4.27%5.46%1.66%
Minnesota,2356569,Aitkin CountyAnoka CountyBecker CountyBeltrami CountyBenton CountyBig Stone CountyBlue Earth CountyBrown CountyCarlton CountyCarver CountyCass CountyChippewa CountyChisago CountyClay CountyClearwater CountyCook CountyCottonwood CountyCrow Wing CountyDakota CountyDodge CountyDouglas CountyFaribault CountyFillmore CountyFreeborn CountyGoodhue CountyGrant CountyHennepin CountyHouston CountyHubbard CountyIsanti CountyItasca CountyJackson CountyKanabec CountyKandiyohi CountyKittson CountyKoochiching CountyLac qui Parle CountyLake CountyLake of the Woods CountyLe Sueur CountyLincoln CountyLyon CountyMcLeod CountyMahnomen CountyMarshall CountyMartin CountyMeeker CountyMille Lacs CountyMorrison CountyMower CountyMurray CountyNicollet CountyNobles CountyNorman CountyOlmsted CountyOtter Tail CountyPennington CountyPine CountyPipestone CountyPolk CountyPope CountyRamsey CountyRed Lake CountyRedwood CountyRenville CountyRice CountyRock CountyRoseau CountySt. Louis CountyScott CountySherburne CountySibley CountyStearns CountySteele CountyStevens CountySwift CountyTodd CountyTraverse CountyWabasha CountyWadena CountyWaseca CountyWashington CountyWatonwan CountyWilkin CountyWinona CountyWright CountyYellow Medicine County,5379139,2672169,2706970,2310413,2343721,2191765,2238106,4429871,949268,NoNoNoNoNoNoNoNoNoNoNoNoNoNoNoNoNoNoNoNoNoNoNoNoNoNoNoNoNoNoNoNoNoNoNoNoNoNoNoNoNoNoNoYesNoNoNoNoNoNoNoNoNoNoNoNoNoNoNoNoNoNoNoNoNoNoNoNoNoNoNoNoNoNoNoNoNoNoNoNoNoNoNoNoNoNoNo,5.33%15.50%12.77%25.99%6.86%2.69%9.67%5.10%11.20%9.67%15.36%9.30%5.53%9.71%13.68%13.52%11.53%4.19%18.45%6.59%3.31%7.63%2.43%12.11%7.21%3.43%28.90%3.18%6.49%5.10%7.41%6.32%4.32%15.64%3.14%6.28%3.84%3.42%4.88%7.74%2.70%12.65%7.48%50.85%5.64%5.71%4.70%9.71%3.53%17.28%5.11%8.91%34.76%8.50%17.46%5.92%8.20%9.79%8.50%10.50%2.78%34.18%6.56%11.88%9.86%15.16%4.96%6.22%7.99%16.08%7.25%9.61%9.93%11.61%8.86%6.07%7.81%7.42%4.61%4.74%10.59%14.98%23.97%5.21%7.60%6.69%9.25%,297962,0%5%0%1%2%0%3%0%1%1%0%1%1%1%0%1%1%1%5%0%1%0%0%1%1%0%12%1%0%1%0%0%0%3%0%1%0%0%0%0%0%2%1%0%0%0%0%0%0%3%0%2%4%0%5%1%1%2%1%1%0%11%1%1%0%4%1%0%1%3%2%0%3%3%1%1%0%0%0%1%2%4%1%0%1%1%0%,264359,1.04%3.79%1.52%1.67%1.77%0.97%2.77%3.47%1.47%4.03%1.41%5.25%1.69%3.81%1.40%1.49%6.60%1.15%6.28%4.56%1.24%5.92%1.03%9.13%3.09%1.73%6.87%0.85%1.70%1.67%1.06%3.12%1.56%11.17%1.76%1.18%2.04%0.96%1.23%5.46%1.55%6.13%5.17%2.37%3.80%3.81%3.26%1.60%1.40%11.11%3.01%3.85%23.87%4.09%4.42%2.86%3.20%2.48%4.34%5.77%0.93%7.28%2.67%2.29%7.22%7.85%2.16%0.82%1.33%4.63%2.22%7.71%2.95%6.84%3.86%3.83%5.28%1.54%2.81%1.37%5.79%3.63%21.55%2.52%2.65%2.69%4.22%
Mississippi,2302724,Adams CountyAlcorn CountyAmite CountyAttala CountyBenton CountyBolivar CountyCalhoun CountyCarroll CountyChickasaw CountyChoctaw CountyClaiborne CountyClarke CountyClay CountyCoahoma CountyCopiah CountyCovington CountyDeSoto CountyForrest CountyFranklin CountyGeorge CountyGreene CountyGrenada CountyHancock CountyHarrison CountyHinds CountyHolmes CountyHumphreys CountyIssaquena CountyItawamba CountyJackson CountyJasper CountyJefferson CountyJefferson Davis CountyJones CountyKemper CountyLafayette CountyLamar CountyLauderdale CountyLawrence CountyLeake CountyLee CountyLeflore CountyLincoln CountyLowndes CountyMadison CountyMarion CountyMarshall CountyMonroe CountyMontgomery CountyNeshoba CountyNewton CountyNoxubee CountyOktibbeha CountyPanola CountyPearl River CountyPerry CountyPike CountyPontotoc CountyPrentiss CountyQuitman CountyRankin CountyScott CountySharkey CountySimpson CountySmith CountyStone CountySunflower CountyTallahatchie CountyTate CountyTippah CountyTishomingo CountyTunica CountyUnion CountyWalthall CountyWarren CountyWashington CountyWayne CountyWebster CountyWilkinson CountyWinston CountyYalobusha CountyYazoo County,2984926,1449291,1535635,884318,904346,844400,875645,1720045,1264881,YesNoNoNoNoYesNoNoNoNoYesNoYesYesYesNoNoNoNoNoNoNoNoNoYesYesYesYesNoNoYesYesYesNoYesNoNoNoNoYesNoYesNoNoNoNoYesNoNoNoNoYesNoYesNoNoYesNoNoYesNoNoYesNoNoNoYesYesNoNoNoYesNoNoYesYesNoNoYesNoNoYes,61.77%16.17%43.15%44.79%40.26%67.65%35.03%35.56%47.70%32.87%85.60%36.53%60.61%77.31%54.66%38.43%30.91%42.13%36.79%11.86%29.10%44.41%14.38%33.87%72.81%84.02%77.69%66.09%8.72%30.72%53.91%86.29%61.52%34.73%65.13%29.63%24.80%46.43%33.91%51.71%32.31%75.67%32.77%47.28%44.22%35.22%51.78%32.78%47.72%40.52%37.63%73.58%42.21%51.97%18.14%22.48%54.98%22.26%16.82%71.12%24.24%49.35%72.37%38.28%25.36%23.08%74.61%63.62%34.32%22.23%6.61%77.81%20.57%47.37%51.09%73.49%41.09%22.40%70.87%48.87%40.52%63.28%,1116367,54%12%41%42%37%65%29%33%43%30%84%35%59%75%51%36%23%37%35%8%27%42%8%23%70%83%75%64%6%22%52%85%60%29%60%24%20%43%31%41%28%73%31%44%39%33%47%31%46%21%30%72%37%49%13%20%52%15%14%69%20%38%71%36%23%20%73%56%31%16%3%74%15%44%48%71%39%20%70%46%38%57%,85260,7.20%2.74%1.02%1.74%1.99%2.04%5.66%1.24%3.77%1.37%0.95%0.97%1.13%1.29%2.81%2.05%4.89%3.47%0.83%2.12%0.99%1.12%3.43%5.35%1.57%0.79%2.35%0.79%1.43%4.91%0.88%0.45%1.10%4.51%0.60%2.17%2.29%1.93%2.08%4.34%2.40%2.42%1.11%1.69%2.88%1.37%3.53%1.01%1.12%1.92%1.57%0.86%1.59%1.55%3.05%0.98%1.30%6.20%1.25%0.83%2.54%10.61%1.27%1.72%1.33%1.57%1.40%5.82%2.41%4.89%2.75%2.11%4.46%1.68%1.91%1.26%1.32%1.33%0.48%0.99%1.50%5.38%
Missouri,3348537,Adair CountyAndrew CountyAtchison CountyAudrain CountyBarry CountyBarton CountyBates CountyBenton CountyBollinger CountyBoone CountyBuchanan CountyButler CountyCaldwell CountyCallaway CountyCamden CountyCape Girardeau CountyCarroll CountyCarter CountyCass CountyCedar CountyChariton CountyChristian CountyClark CountyClay CountyClinton CountyCole CountyCooper CountyCrawford CountyDade CountyDallas CountyDaviess CountyDeKalb CountyDent CountyDouglas CountyDunklin CountyFranklin CountyGasconade CountyGentry CountyGreene CountyGrundy CountyHarrison CountyHenry CountyHickory CountyHolt CountyHoward CountyHowell CountyIron CountyJackson CountyJasper CountyJefferson CountyJohnson CountyKnox CountyLaclede CountyLafayette CountyLawrence CountyLewis CountyLincoln CountyLinn CountyLivingston CountyMcDonald CountyMacon CountyMadison CountyMaries CountyMarion CountyMercer CountyMiller CountyMississippi CountyMoniteau CountyMonroe CountyMontgomery CountyMorgan CountyNew Madrid CountyNewton CountyNodaway CountyOregon CountyOsage CountyOzark CountyPemiscot CountyPerry CountyPettis CountyPhelps CountyPike CountyPlatte CountyPolk CountyPulaski CountyPutnam CountyRalls CountyRandolph CountyRay CountyReynolds CountyRipley CountySt. Charles CountySt. Clair CountySte. Genevieve CountySt. Francois CountySt. Louis CountySaline CountySchuyler CountyScotland CountyScott CountyShannon CountyShelby CountyStoddard CountyStone CountySullivan CountyTaney CountyTexas CountyVernon CountyWarren CountyWashington CountyWayne CountyWebster CountyWorth CountyWright CountySt. Louis city,6021988,2951036,3070952,2485574,2564030,2384684,2471801,4856485,1165503,NoNoNoNoNoNoNoNoNoNoNoNoNoNoNoNoNoNoNoNoNoNoNoNoNoNoNoNoNoNoNoNoNoNoNoNoNoNoNoNoNoNoNoNoNoNoNoNoNoNoNoNoNoNoNoNoNoNoNoNoNoNoNoNoNoNoNoNoNoNoNoNoNoNoNoNoNoNoNoNoNoNoNoNoNoNoNoNoNoNoNoNoNoNoNoNoNoNoNoNoNoNoNoNoNoNoNoNoNoNoNoNoNoNoYes,7.73%4.38%3.48%11.85%11.93%6.26%4.84%4.29%2.87%19.30%14.67%10.32%4.64%8.95%5.05%12.40%5.07%5.27%10.65%4.38%4.04%6.15%2.70%16.57%5.97%17.20%10.94%3.94%5.51%4.73%3.16%14.93%4.75%3.87%17.81%4.28%3.24%2.42%10.93%4.39%3.90%5.30%4.13%3.29%9.00%4.80%5.02%36.81%14.17%4.75%12.91%3.41%5.67%7.39%9.62%6.99%6.20%4.21%5.97%20.18%5.71%4.03%3.23%9.25%3.27%4.61%27.41%9.83%6.03%5.09%5.14%19.34%12.72%6.73%5.02%1.83%3.85%30.77%4.09%13.60%10.34%11.18%16.58%5.40%28.39%2.68%3.96%10.38%5.61%4.38%4.39%11.39%5.00%3.14%7.50%31.72%17.94%2.06%1.80%15.35%5.34%2.95%3.94%4.44%20.23%9.69%8.13%5.30%7.45%5.24%3.93%4.98%3.13%4.28%57.07%,706079,2%1%1%7%0%0%1%0%0%9%6%6%1%5%1%7%2%0%4%0%2%1%0%6%2%12%7%0%0%0%0%11%0%0%10%1%0%0%3%1%1%1%0%0%5%0%1%24%2%1%5%0%1%2%0%3%2%1%3%1%2%0%0%5%0%1%24%4%3%2%1%16%1%3%0%0%0%27%0%3%2%8%6%1%12%0%1%6%1%1%0%4%1%1%4%24%6%0%0%11%0%1%1%0%1%1%3%1%2%2%1%1%1%1%49%,225314,2.26%1.96%1.00%2.77%8.00%2.33%1.88%1.61%0.87%3.10%5.69%1.59%1.80%1.71%2.44%2.11%1.27%2.04%4.08%1.73%0.69%2.69%0.83%6.17%1.80%2.62%1.40%1.61%1.61%1.74%1.20%1.95%1.25%0.98%5.89%1.51%1.21%0.71%3.20%1.84%1.75%1.86%1.10%0.84%1.29%1.73%1.35%8.50%7.05%1.64%3.56%1.25%2.08%2.42%6.70%1.64%2.10%1.87%1.32%11.17%1.18%1.86%1.05%1.44%0.99%1.59%1.91%4.26%1.03%1.53%1.90%1.34%4.81%1.39%1.45%0.66%1.54%2.27%1.98%7.66%2.19%2.04%5.39%1.99%9.69%0.87%1.26%1.70%2.15%1.17%1.30%2.98%1.83%0.85%1.31%2.65%9.09%0.85%0.68%1.95%1.68%1.12%1.39%1.92%18.35%5.23%1.93%1.84%2.99%1.20%1.26%1.80%1.15%1.57%3.65%
